mysql> use sse03;
Database changed
mysql> show tables;
+-----------------+
| Tables_in_sse03 |
+-----------------+
| student         |
| student04       |
| student2        |
+-----------------+
3 rows in set (0.00 sec)

mysql> alter table student04 add subject varchar(20);
ERROR 1060 (42S21): Duplicate column name 'subject'
mysql> alter table student04 add(subject varchar(20));
ERROR 1060 (42S21): Duplicate column name 'subject'
mysql> alter table student04 add(club varchar(20));
Query OK, 4 rows affected (0.02 sec)
Records: 4  Duplicates: 0  Warnings: 0

mysql> update student04 set club="dance" where Regno=190001011;
Query OK, 1 row affected (0.00 sec)
Rows matched: 1  Changed: 1  Warnings: 0

mysql> update student set club="codeing" where hosteller="0";
ERROR 1054 (42S22): Unknown column 'hosteller' in 'where clause'
mysql> update student set club="codeing" where name="jebi";
ERROR 1054 (42S22): Unknown column 'club' in 'field list'
mysql> update student04 set club="codeing" where name="jebi";
Query OK, 1 row affected (0.00 sec)
Rows matched: 1  Changed: 1  Warnings: 0

mysql> update student04 set club="eco" where dept="AIML";
Query OK, 1 row affected (0.00 sec)
Rows matched: 1  Changed: 1  Warnings: 0

mysql> update student04 set club="music" where year="2";
Query OK, 1 row affected (0.00 sec)
Rows matched: 1  Changed: 1  Warnings: 0

mysql> select*from student04;
+-----------+---------+-----------+------------+------+------+---------+---------+
| Regno     | name    | hosteller | dayscholar | dept | year | subject | club    |
+-----------+---------+-----------+------------+------+------+---------+---------+
| 190001011 | rahul   |         1 |          0 | CSC  | NULL | POM     | dance   |
| 190001012 | jebi    |         0 |          1 | IT   |    1 | NULL    | codeing |
| 190001013 | akash   |         0 |          1 | AIML |    3 | NULL    | eco     |
| 190001014 | darshan |         1 |          0 | CSC  |    2 | NULL    | music   |
+-----------+---------+-----------+------------+------+------+---------+---------+
4 rows in set (0.00 sec)
